### ISSUE TITLE
Invalidate arp cache when reusing ips

### ISSUE THREAD

**Issue by bprashanth** [appc/cni#88]
I create a netcat server that looks up hostname, and a netcat client. I kept the client up, and deleted/recreated the server. It kept coming up with the same ip. However, on the host:
```
root@e2e-test-beeps-minion-jzy6:/home/beeps# arp -a
? (10.245.1.5) at 02:e6:f9:ed:a0:8b [ether] on cbr0
? (10.245.1.3) at 1a:20:f0:ed:ec:cd [ether] on cbr0
? (10.245.1.4) at de:30:22:0a:5c:24 [ether] on cbr0
? (10.240.0.1) at 42:01:0a:f0:00:01 [ether] on eth0

---[duration T1]---

? (10.245.1.5) at <incomplete> on cbr0
? (10.245.1.3) at 1a:20:f0:ed:ec:cd [ether] on cbr0
? (10.245.1.4) at de:30:22:0a:5c:24 [ether] on cbr0
? (10.240.0.1) at 42:01:0a:f0:00:01 [ether] on eth0
```

if during duration T1 I send some udp packets to the server through nc -u, tcpdump on the eth0 of the server (inside the container), shows:

Client:
```
# nc -u 10.245.1.5 8081
hostName
hostName
hostName

--- 3 failures

hostName
netserver-4
```
Server:
```
15:16:17-beeps~/goproj/src/k8s.io/kubernetes] (kubelet_plugins)$ ./repro.sh 
pod "netserver-4" deleted
pod "netserver-4" created
tcpdump: listening on eth0, link-type EN10MB (Ethernet), capture size 65535 bytes
23:16:34.978072 IP (tos 0x0, ttl 62, id 42388, offset 0, flags [DF], proto UDP (17), length 37)
    10.245.2.6.35824 > 10.245.1.5.8081: [udp sum ok] UDP, length 9
23:16:41.778665 IP (tos 0x0, ttl 62, id 42414, offset 0, flags [DF], proto UDP (17), length 37)
    10.245.2.6.35824 > 10.245.1.5.8081: [udp sum ok] UDP, length 9
23:16:46.928938 IP (tos 0x0, ttl 62, id 43415, offset 0, flags [DF], proto UDP (17), length 37)
    10.245.2.6.35824 > 10.245.1.5.8081: [udp sum ok] UDP, length 9


-----3 failures




23:18:03.738968 ARP, Ethernet (len 6), IPv4 (len 4), Request who-has 10.245.1.5 tell 10.245.1.1, length 28
23:18:04.738960 ARP, Ethernet (len 6), IPv4 (len 4), Request who-has 10.245.1.5 tell 10.245.1.1, length 28
23:18:05.738956 ARP, Ethernet (len 6), IPv4 (len 4), Request who-has 10.245.1.5 tell 10.245.1.1, length 28
23:18:07.873561 ARP, Ethernet (len 6), IPv4 (len 4), Request who-has 10.245.1.5 tell 10.245.1.1, length 28
23:18:07.873586 ARP, Ethernet (len 6), IPv4 (len 4), Reply 10.245.1.5 is-at 02:1a:0e:6b:ba:36, length 28

------now another one 

23:18:07.873600 IP (tos 0x0, ttl 62, id 53565, offset 0, flags [DF], proto UDP (17), length 37)
    10.245.2.6.35824 > 10.245.1.5.8081: [udp sum ok] UDP, length 9
23:18:07.873811 IP (tos 0x0, ttl 64, id 6569, offset 0, flags [DF], proto UDP (17), length 39)
    10.245.1.5.8081 > 10.245.2.6.35824: [bad udp cksum 0x1919 -> 0xd673!] UDP, length 11
23:18:12.874950 ARP, Ethernet (len 6), IPv4 (len 4), Request who-has 10.245.1.1 tell 10.245.1.5, length 28
23:18:12.874980 ARP, Ethernet (len 6), IPv4 (len 4), Reply 10.245.1.1 is-at 52:17:41:2a:8b:a4, length 28
```

This is with v0.1.0, @eyakubovich thoughts?

Edit: net.conf
```
{
  "bridge":"cbr0",
  "ipam":{
    "routes":[{"dst":"0.0.0.0/0"}],
    "subnet":"10.245.1.0/24",
    "type":"host-local"
  },
  "isGateway":true,
  "name":"kubenet",
  "type":"bridge"
}
```

**Comment by bprashanth** [comment]
If you want a better repro (using docker pods): https://gist.github.com/bprashanth/06e30ca02370df875892

**Comment by thockin** [comment]
This should not reuse IPs until it has to.  It's more likely to cause problems than be useful.  I think it should do probably round-robin IPs like docker

**Comment by steveeJ** [comment]
@bprashanth please provide the `repro.sh`, I'm not clear what exactly is happening here. It seems like the on-disk information has been deleted without cleaning up the interfaces.

As described in https://github.com/appc/cni/blob/v0.1.0/plugins/ipam/host-local/README.md#backends, the *host-local* IPAM plugin stores already used IPs on disk. If it's cleaned up by executing the plugin with `DEL` instructions it should not leave behind any interfaces with addresses. This should cause ARP to function properly when a new interface is added with the previous IP.

**Comment by bprashanth** [comment]
I can get a better repro when I have some time. Are you OK with a repro script that uses Kubernetes pods or would you like me to try with plain docker containers? It's just easier with the former, if you have a kubernetes cluster at your disposal.

**Comment by steveeJ** [comment]
@bprashanth I'm just trying to get an idea of what's in the script, so anything you have is fine for me.

**Comment by bprashanth** [comment]
So I was running:
1. The CNI bridge plugin to hookup docker containers with `net=none` as Kubernetes pods
2. A udp server pod

So `CNI add` for a kubernetes pause container, then join a udp server to that net namespace with --net=pause-container. This is the standard Kubernetes pod configuration represented via a pod like: https://gist.github.com/bprashanth/06e30ca02370df875892#file-gistfile1-txt-L3. This udp server will echo its hostname (netserver-4 in this case) when it receives a request like: `echo hostName | timeout 1 nc -u <podip> 8081`.

What I observed was that with a couple of retries with a script like:
```bash
#! /bin/bash
kubectl delete pod netserver-4 --grace-period=0; 
kubectl create -f ~/rtmp/kubeproxytest/netserver.yaml; 
sleep 2;
kubectl exec -it netserver-4 -- tcpdump -i eth0 -n -vv
```

If you make sure the same pod lands on the same node, such that it acquires the IP it just released, the first few udp requests would get dropped (sometimes), till an arp request flies past on the tcpdump stream, after which all requests succeed. 

Essentially in the fail case:

From vm1:
```
# nc -u 10.245.1.5 8081
hostName
hostName
hostName
hostName
hostName
netserver-4
```

And on vm2, where we have the udp server running with ip `10.245.1.5` you'd see the tcpdump output show something like:
```
pod "netserver-4" deleted
pod "netserver-4" created
tcpdump: listening on eth0, link-type EN10MB (Ethernet), capture size 65535 bytes
23:16:34.978072 IP (tos 0x0, ttl 62, id 42388, offset 0, flags [DF], proto UDP (17), length 37)
    10.245.2.6.35824 > 10.245.1.5.8081: [udp sum ok] UDP, length 9
23:16:41.778665 IP (tos 0x0, ttl 62, id 42414, offset 0, flags [DF], proto UDP (17), length 37)
    10.245.2.6.35824 > 10.245.1.5.8081: [udp sum ok] UDP, length 9
23:16:46.928938 IP (tos 0x0, ttl 62, id 43415, offset 0, flags [DF], proto UDP (17), length 37)
    10.245.2.6.35824 > 10.245.1.5.8081: [udp sum ok] UDP, length 9
```
and then the arp:
```
23:18:03.738968 ARP, Ethernet (len 6), IPv4 (len 4), Request who-has 10.245.1.5 tell 10.245.1.1, length 28
23:18:04.738960 ARP, Ethernet (len 6), IPv4 (len 4), Request who-has 10.245.1.5 tell 10.245.1.1, length 28
23:18:05.738956 ARP, Ethernet (len 6), IPv4 (len 4), Request who-has 10.245.1.5 tell 10.245.1.1, length 28
23:18:07.873561 ARP, Ethernet (len 6), IPv4 (len 4), Request who-has 10.245.1.5 tell 10.245.1.1, length 28
23:18:07.873586 ARP, Ethernet (len 6), IPv4 (len 4), Reply 10.245.1.5 is-at 02:1a:0e:6b:ba:36, length 28
```

And then success:
```
23:18:07.873600 IP (tos 0x0, ttl 62, id 53565, offset 0, flags [DF], proto UDP (17), length 37)
    10.245.2.6.35824 > 10.245.1.5.8081: [udp sum ok] UDP, length 9
23:18:07.873811 IP (tos 0x0, ttl 64, id 6569, offset 0, flags [DF], proto UDP (17), length 39)
    10.245.1.5.8081 > 10.245.2.6.35824: [bad udp cksum 0x1919 -> 0xd673!] UDP, length 11
23:18:12.874950 ARP, Ethernet (len 6), IPv4 (len 4), Request who-has 10.245.1.1 tell 10.245.1.5, length 28
23:18:12.874980 ARP, Ethernet (len 6), IPv4 (len 4), Reply 10.245.1.1 is-at 52:17:41:2a:8b:a4, length 28
```

I haven't tried reproducing this recently, but I did notice that the arp cache on the host seemed to be pointing to the old MAC during the failures.

**Comment by steveeJ** [comment]
@bprashanth thanks for taking your time to describe this. What's still missing for my understanding is where CNI is executed with either ADD or DEL. My guess would be the `kubectl create` and `kubectl delete` calls respectively, but I'd rather not rely on a guess.

**Comment by bprashanth** [comment]
Yeah. When you setup a kubernetes pod, it does the following:
* Create a pause container with net=none: this is essentially a while true loop to hold onto the net ns.
  * Invoke CNI ADD `cni_json` on the bridge plugin, so this pause container is added to some bridge, gets routes configured etc. 
*  Create the actualy containers in the pod (udp server running this image: https://gist.github.com/bprashanth/06e30ca02370df875892#file-gistfile1-txt-L14), joining them to the namespace of the pause container

And the reverse happens on `kubectl delete`. I suppose this might be easier to try and repro once we've merged CNI plugin support into Kubernetes, but in theory there shouldn't be anything Kube specific in there.

**Comment by bprashanth** [comment]
We have CNI up and running in kube and it seems to be mostly fine, no reason to leave this open. Will report back if I get a chance to try and repro, but till then assume this is fixed.
